{"producer":[{"identity_policy":[{"match":"exact","name":"arch","value":"arm64"},{"match":"sha256","name":"compiler_binary_sha256"},{"match":"exact","name":"compiler_command","value":"clang"},{"match":"exact","name":"compiler_family","value":"clang"},{"match":"present","name":"compiler_target"},{"match":"present","name":"compiler_version"},{"match":"present","name":"image_os"},{"match":"present","name":"image_version"},{"match":"exact","name":"os","value":"macos"},{"match":"exact","name":"runner_label","value":"macos-15"}],"identity_strategy":"github-hosted","role_id":"bundle-builder"}],"profile_id":"macos-arm64-github-hosted-clang-v1","schema_version":1,"target_id":"macos-arm64","validator":[{"identity_policy":[{"match":"exact","name":"arch","value":"arm64"},{"match":"sha256","name":"compiler_binary_sha256"},{"match":"exact","name":"compiler_command","value":"clang"},{"match":"exact","name":"compiler_family","value":"clang"},{"match":"present","name":"compiler_target"},{"match":"present","name":"compiler_version"},{"match":"present","name":"image_os"},{"match":"present","name":"image_version"},{"match":"exact","name":"os","value":"macos"},{"match":"exact","name":"runner_label","value":"macos-15"}],"identity_strategy":"github-hosted","role_id":"contract-validator"}]}